{"schema_version":"anpr-data-lifecycle-v1","processing_scope":"single_request_in_controlled_memory","storage_policy":"no_intentional_server_side_retention","retained_server_side":[],"prohibited_uses":["training","evaluation","analytics","dataset_construction","debug_archive","unrelated_reuse","future_processing","request_replay","result_cache"],"cleanup_outcomes":["success","validation_failure","no_detection","recognition_failure","timeout","cancellation","client_disconnect","internal_exception","service_shutdown"],"released_buffers":["source_image","decoded_image","crop","tensor","annotated_result","request_buffer"],"lock_release":"finally_on_every_outcome"}
